{
  "schema_version": "0.2",
  "task_id": "VER-0002",
  "task_type": "development",
  "objective": "Synthetic verification task for the v0.3 controller (no product value): create the file tasks/VER-0002/out.txt whose content is the single line 'done'.",
  "inputs": [],
  "constraints": [
    "synthetic verification task; change nothing outside tasks/VER-0002"
  ],
  "allowed_paths": [
    "tasks/VER-0002"
  ],
  "acceptance_criteria": [
    {
      "id": "AC1",
      "description": "out.txt says done",
      "dimension": "spec_conformance",
      "verification": {
        "method": "command",
        "command": "grep -q done tasks/VER-0002/out.txt"
      }
    },
    {
      "id": "AC2",
      "description": "out.txt is not empty",
      "dimension": "correctness",
      "verification": {
        "method": "command",
        "command": "test -s tasks/VER-0002/out.txt"
      }
    },
    {
      "id": "AC3",
      "description": "nothing else needed",
      "dimension": "completeness",
      "verification": {
        "method": "inspection"
      }
    }
  ],
  "failure_conditions": [
    {
      "id": "FC1",
      "description": "file missing",
      "on_trigger": "rework"
    }
  ],
  "assigned_agent": "claude-code",
  "reviewer": "codex-cli",
  "status": "ready",
  "evidence": [],
  "quality": {
    "spec_conformance": {
      "verdict": "UNVERIFIED",
      "evidence_ids": [],
      "judged_by": null
    },
    "correctness": {
      "verdict": "UNVERIFIED",
      "evidence_ids": [],
      "judged_by": null
    },
    "completeness": {
      "verdict": "UNVERIFIED",
      "evidence_ids": [],
      "judged_by": null
    }
  },
  "retry_count": 0,
  "max_retries": 2,
  "escalation_reason": null,
  "history": [
    {
      "from": "draft",
      "to": "ready",
      "at": "2026-10-11T06:00:00Z",
      "by": "claude-code",
      "note": "synthetic task for live controller verification, written by Claude Code"
    }
  ]
}
