{
  "schema_version": "0.2",
  "task_id": "DUMMY-0001",
  "task_type": "development",
  "objective": "ローカルCLIの初回確認用ダミータスク（実案件ではない）。tasks/DUMMY-0001/out.txt に 'done' と書く。",
  "inputs": [],
  "constraints": [
    "ダミータスク: 実案件・顧客データ・秘密情報を扱わない",
    "tasks/DUMMY-0001 の外を変更しない"
  ],
  "allowed_paths": [
    "tasks/DUMMY-0001"
  ],
  "acceptance_criteria": [
    {
      "id": "AC1",
      "description": "out.txt に done と書かれている",
      "dimension": "spec_conformance",
      "verification": {
        "method": "command",
        "command": "grep -q done tasks/DUMMY-0001/out.txt"
      }
    },
    {
      "id": "AC2",
      "description": "out.txt が空でない",
      "dimension": "correctness",
      "verification": {
        "method": "command",
        "command": "test -s tasks/DUMMY-0001/out.txt"
      }
    },
    {
      "id": "AC3",
      "description": "ほかに必要なものはない",
      "dimension": "completeness",
      "verification": {
        "method": "inspection"
      }
    }
  ],
  "failure_conditions": [
    {
      "id": "FC1",
      "description": "out.txt がない",
      "on_trigger": "rework"
    }
  ],
  "assigned_agent": "claude-code",
  "reviewer": "codex-cli",
  "status": "ready",
  "evidence": [],
  "quality": {
    "spec_conformance": {
      "verdict": "UNVERIFIED",
      "evidence_ids": [],
      "judged_by": null
    },
    "correctness": {
      "verdict": "UNVERIFIED",
      "evidence_ids": [],
      "judged_by": null
    },
    "completeness": {
      "verdict": "UNVERIFIED",
      "evidence_ids": [],
      "judged_by": null
    }
  },
  "retry_count": 0,
  "max_retries": 2,
  "escalation_reason": null,
  "history": [
    {
      "from": "draft",
      "to": "ready",
      "at": "2026-10-13T00:00:00Z",
      "by": "claude-code",
      "note": "local CLI dummy task (no real project); copy to tasks/DUMMY-0001/task.json of a local-only data repo"
    }
  ]
}
